"conversation_id_str","created_at","favorite_count","full_text","id_str","image_url","in_reply_to_screen_name","lang","location","quote_count","reply_count","retweet_count","tweet_url","user_id_str","username"
"1907944786834895260","Thu Apr 03 23:54:19 +0000 2025","7","Tweet apresiasi film JUMBO Animasinya bagus Ceritanya seru Soundtracknya enak didengerin Background karakternya agak dark sih Film yang dibuat dari hati ini sih https://t.co/7fBz4Y6P4C","1907944786834895260","https://pbs.twimg.com/media/GnphqmUagAAF5ym.jpg","","in","","0","0","2","https://x.com/diazzz_w/status/1907944786834895260","1033205310905671680","diazzz_w"
"1907944473059013075","Thu Apr 03 23:53:04 +0000 2025","5","Jumbo adalah Film untuk saya anak saya dan anak-anak dalam diri saya. I love this film so much. First Cinema Experience buat anakku Djarum. Terima kasih banyak @Adriandhy","1907944473059013075","","","in","Jakarta - Bandung , ID","0","0","3","https://x.com/__binar/status/1907944473059013075","254829008","__binar"
"1907943729178325444","Thu Apr 03 23:50:07 +0000 2025","3","Semua harus nonton film Jumbo sih. Animasinya bagus ceritanya ringan dan oke. Bangga banget Indonesia ada film begini. Kemaren wa nonton bersebelas (without promo!!).","1907943729178325444","","","in","","0","0","1","https://x.com/hikari228__/status/1907943729178325444","993075356423806978","hikari228__"
"1907470309793673545","Thu Apr 03 23:22:47 +0000 2025","2","sepupuku be like: sebelum nonton: mau nonton apa? gatau tuh katanya mau liat jumbo(?) au dah film apaan setelah nonton: BUNGA MAH BUNGA MATAHARI MAH MATAHARI ","1907936851362721975","","senargitaruji","in","","0","2","0","https://x.com/senargitaruji/status/1907936851362721975","1333618149074210817","senargitaruji"
"1907819828062429606","Thu Apr 03 23:21:06 +0000 2025","0","@julpikaaar Terlihat dari adanya film Jumbo kahh","1907936426580459593","","julpikaaar","in","","0","1","0","https://x.com/nasyewuw/status/1907936426580459593","1477998556757651456","nasyewuw"
"1907788243598454883","Thu Apr 03 23:20:50 +0000 2025","82","@HabisNontonFilm Film sekeren jumbo layak sih dapet 8.6 ","1907936361061167150","","HabisNontonFilm","in","","0","0","1","https://x.com/meishe18/status/1907936361061167150","1270402982127865856","meishe18"
"1907934933139833262","Thu Apr 03 23:15:10 +0000 2025","2","Bisa ga sih bioskop diketatin lagi soal batasan umur mempengaruhi perilaku loh apa yang ditonton itu :(( kek ada film jumbo kenapa ada aja yg masih bawa nonton pabrik gula uncut","1907934933139833262","","","in","","0","0","0","https://x.com/karinabluy/status/1907934933139833262","1515158931949391872","karinabluy"
"1906988108383735851","Thu Apr 03 23:09:07 +0000 2025","3","@DarkOushiza Kasti cukup populer di tahun 90an dan jadi permainan sehari-hari bagi kami anak-anak Kalimantan. Mengingat latar film Jumbo tahun 2000 saat belum ada gadget dan latar ekonomi anak-anak di film ini menengah ke bawah yang belum mampu beli Sega/PS kayaknya kasti masuk akal.","1907933411161092322","","DarkOushiza","in","Indonesia","0","2","1","https://x.com/raiyaroof/status/1907933411161092322","431619799","raiyaroof"
"1907925114261483881","Thu Apr 03 22:36:09 +0000 2025","10","sejujurnya bisa nangis 3x di film jumbo tapi setiap kambing2 skena itu muncul bubar jalan semua rasa haru gw","1907925114261483881","","","in","","0","1","3","https://x.com/enigmaticdaisy/status/1907925114261483881","1337440303725232129","enigmaticdaisy"
"1907835862546788632","Thu Apr 03 22:16:35 +0000 2025","15","@cinepoint_ Wah hampir gak percaya mulai dari 60 ribuan bisa naik signifikan 2x di hari ke empat buat film animasi Jumbo bangga rasanya.","1907920191436300713","","cinepoint_","in","","0","0","0","https://x.com/simisbah/status/1907920191436300713","1671461996","simisbah"
"1907914483563114515","Thu Apr 03 21:53:54 +0000 2025","9","Terima kasih ya Bang @Adriandhy dan semua orang yang terlibat dalam pembuatan film animasi Jumbo. Terima kasih sudah hadir di tengah hiruk piruk perutbk-an ini. Sangat-sangat berhasil menghibur anak 1 bulan lebih 18 tahun . https://t.co/H9PWGL4DtR","1907914483563114515","https://pbs.twimg.com/media/GnpGGj8aMAMCwlf.jpg","","in","","0","1","1","https://x.com/ninuninuninnnuu/status/1907914483563114515","1624388020144320512","ninuninuninnnuu"
"1907911289747419477","Thu Apr 03 21:41:13 +0000 2025","3","Sedih juga lagunya jumbo kalau dipahami maaf ya ngatangatain dontol terus tp sedih dikit terharu khususnya sama film animasi indo yang alhamdulilah semakin maju","1907911289747419477","","","in","","0","1","0","https://x.com/cisotonic/status/1907911289747419477","1290949919713288192","cisotonic"
"1907907554048618570","Thu Apr 03 21:26:22 +0000 2025","0","I udah berharap film jumbo penontonnya murni karena emg sebagus itu animasinya ternyata juga pke buzzer kyk film pabrik gula cuma emg pabrik gula lebih banyak aja ngerekrut buzzernya pantes I bingung kok bisa baru sehari udah 200k + penonton","1907907554048618570","","","in","","0","0","0","https://x.com/jaehyunluvals/status/1907907554048618570","1513950893653508096","jaehyunluvals"
"1907900545928671243","Thu Apr 03 20:58:31 +0000 2025","2","Karakter favorit sepanjang film Jumbo @VisinemaID #JumbokanBioskop #JumboUntukSemua https://t.co/nlQugvD89D","1907900545928671243","https://pbs.twimg.com/media/Gno5b10aUAAdr_A.jpg","","in","","0","0","0","https://x.com/gemuruhcahaya22/status/1907900545928671243","1663947388489457665","gemuruhcahaya22"
"1907835862546788632","Thu Apr 03 20:32:38 +0000 2025","0","@catlover84 @TrainMaths @yudhitrielz @cinepoint_ Feelingku mungkin film lebaran (yg horor) bisa mentok sampe tgl 16 film Jumbo kemungkinan bakal turun show lebih banyak setelah tgl 9","1907894032409456666","","Fachal1578","in","","0","1","0","https://x.com/Fachal1578/status/1907894032409456666","1878940109112008705","Fachal1578"
"1907893639533236510","Thu Apr 03 20:31:05 +0000 2025","3","YEYYY JUMBO terharuu Film Animasi Indo kesayangan~ congratssss.","1907893639533236510","","","in","somewhere only we know","0","0","0","https://x.com/pixiedustale/status/1907893639533236510","1618237399238340608","pixiedustale"
"1907892639107887387","Thu Apr 03 20:27:06 +0000 2025","0","Halo puspen tni mohon di cek film jumbo memiliki nuansa anti pembangunan??? Melawan hakekat presiden kita jokowi bapak pembangunan nasional???","1907892639107887387","","","in","","0","0","0","https://x.com/gabrielpartogi/status/1907892639107887387","126856968","gabrielpartogi"
"1907889948377886998","Thu Apr 03 20:16:25 +0000 2025","4","Jumbo yang paling signifikan naik jumlah penontonnya. ","1907889948377886998","","","in","Jakarta Selatan","0","0","0","https://x.com/persadaichwan/status/1907889948377886998","1448411745534373894","persadaichwan"
"1907888542019367022","Thu Apr 03 20:10:49 +0000 2025","1","Malam Jumat ditemeni Pramugari dan DJ JAEMIN ON INTERFM Nonton Film Jumbo enak kali ya? https://t.co/bOP1HOlLXm","1907888542019367022","","","in","","0","0","0","https://x.com/hendri_tobing/status/1907888542019367022","474780888","hendri_tobing"
"1907886467013292322","Thu Apr 03 20:02:35 +0000 2025","3","kalo ada yg masih ragu bimbang bingung mau nonton apa dari sekian film yg ada di bioskop sekarang NONTON JUMBO!!! gak akan nyesel serius deh untuk masyarakat indonesia yg tiap bulan disuapin film horor film ini terasa sangat fresh dan berasa perbedaan kuliatasnya ","1907886467013292322","","","in","neocity","0","0","1","https://x.com/annalostelsa/status/1907886467013292322","1660268246808035328","annalostelsa"
"1907876914330788345","Thu Apr 03 19:24:37 +0000 2025","1","*Lomba Film Lebaran Hari ke-4* Penonton Hitungan Cinepoint #PabrikGula 1.372 285 #Qodrat2 494.700 #Jumbo 412.119 #Komang 386.572 #Norma 190.643 Maka total film Indonesia tahun 2025 sudah mencapai 12 juta + penonton! Kamis 3 April 2025 https://t.co/U4EkTym3Tk","1907876914330788345","https://pbs.twimg.com/amplify_video_thumb/1907827120380006400/img/jHsXQZX1XaNU1opZ.jpg","","in","Jakarta","0","0","0","https://x.com/yan_widjaya/status/1907876914330788345","1575338724","yan_widjaya"
"1907876379842195972","Thu Apr 03 19:22:30 +0000 2025","6","Tentu saja JUMBO!! aku nungguin film nya rilis 4 tahun lhooo","1907876379842195972","","","in","Kasur empuk ","0","0","1","https://x.com/vinamusti/status/1907876379842195972","1231571921558364165","vinamusti"
"1907868624616042949","Thu Apr 03 19:06:57 +0000 2025","0","@astrophilleeii Ini film jumbo di bioskop kan?","1907872467252863346","","astrophilleeii","in","Bukittinggi, Lampung, Bandung","0","3","0","https://x.com/fikrinmasadepan/status/1907872467252863346","1222189792017862657","fikrinmasadepan"
"1907871871254802757","Thu Apr 03 19:04:35 +0000 2025","1","Udah nonton blum..? Film ini menggambarkan jlas konflik 1965 Cinta terlarang anak anshor dgn anak simpatisan pki... Penuh darah air mata dan romantisme yg tidk murahan Kupu Kupu Kertas Tonton deh biar kamu paham Lupain jokowi jumbo walid dan sang pramugari https://t.co/UPgzCvtyLs","1907871871254802757","https://pbs.twimg.com/media/GnofWzDaMAMmO-u.jpg","","in","","0","0","0","https://x.com/mangkuto_alam33/status/1907871871254802757","1765980592494223360","mangkuto_alam33"
"1907870953465668002","Thu Apr 03 19:00:56 +0000 2025","3","Pengen nonton film Jumbo","1907870953465668002","","","in","Ravenclaw","0","1","0","https://x.com/oxfordest/status/1907870953465668002","3165092916","oxfordest"
"1907869415930212711","Thu Apr 03 18:54:49 +0000 2025","181","Film JUMBO ini harus box office. Karya banyak anak bangsa . Selama gue nonton beneran tercengang bisaloh Indonesia buat animasi bagus gini. Inner child gue balik setelah nonton film ini kayak gimana ya susah buat jelasin. POKOKNYA WAJIB NONTON‼️ https://t.co/FEo1E2XfP4","1907869415930212711","https://pbs.twimg.com/amplify_video_thumb/1907810795276349440/img/GmemPi6je2u1pQoG.jpg","","in","Relationsea","1","1","63","https://x.com/ecistmrg/status/1907869415930212711","1570427104587821056","ecistmrg"
"1907865438341705802","Thu Apr 03 18:39:01 +0000 2025","1","Sepertinya nonton Jumbo bakal ngebalikin semangat gua nonton film lagi at least ik it's gonna be fun experience but i just don't have that mood rn.","1907865438341705802","","","in","he/him","0","0","0","https://x.com/Geentarouu/status/1907865438341705802","1607508564737916928","Geentarouu"
"1907863160062918791","Thu Apr 03 18:29:58 +0000 2025","1","siapa yg nangis nonton film Jumbo? Saya","1907863160062918791","","","in","Konoha","0","0","0","https://x.com/gweenzzzy/status/1907863160062918791","1877000174092050432","gweenzzzy"
"1907857045975609574","Thu Apr 03 18:05:40 +0000 2025","2","reaksi sepanjang nonton film jumbo ","1907857045975609574","","","in","","0","0","1","https://x.com/siapanigatausi/status/1907857045975609574","1317337245704073218","siapanigatausi"
"1907697523877085460","Thu Apr 03 18:05:33 +0000 2025","0","@awanbanyus @Adriandhy Ya Jumbo beneran jumbo! Balon Don di Candi Prambanan tingginya 10 meter (32 8 kaki) cukup besar buat narik perhatian pas libur Lebaran 2025. Acara ini bagian dari promo film *Jumbo* bareng aktivitas budaya kayak permainan tradisional dan ballet Ramayana. https://t.co/euZMb8yIyf","1907857015038239097","https://pbs.twimg.com/media/GnglrYbbAAAbx1A.jpg","awanbanyus","in","wherever you are","0","0","0","https://x.com/grok/status/1907857015038239097","1720665183188922368","grok"
"1907855838561345930","Thu Apr 03 18:01:30 +0000 2025","0","Ayo ke bioskop nonton film Jumbo!!!","1907855997219254423","","ngabisalari","in","","0","0","0","https://x.com/ngabisalari/status/1907855997219254423","1841094627346300932","ngabisalari"
"1907853303511396376","Thu Apr 03 17:50:48 +0000 2025","0","Betul itu pure dari pendapat saya pribadi Mas dan juga hasil tukar fikiran saya setelah menonton dengan beberapa kerabat saya yg juga bbrp dari mereka telah memiliki anak di acara preview screening session:Jumbo tapi balik lagi kami enjoy menonton Film Jumbo secara overall","1907853303511396376","","","in","","0","0","0","https://x.com/holyyionn/status/1907853303511396376","88875616","holyyionn"
"1907837763459985833","Thu Apr 03 17:46:19 +0000 2025","0","@Adriandhy Aamiin. Terimakasih buat bang ryan yang udah bikin film jumbo️","1907852177445671398","","Adriandhy","in","Kota Semarang, Jawa Tengah","0","0","0","https://x.com/AnbarDiko/status/1907852177445671398","1181483069108187136","AnbarDiko"
"1907851267529125941","Thu Apr 03 17:42:42 +0000 2025","14","Ini dia guys salah satu editor dari trailer Film JUMBO mari kita serbu dengan lope lope yang banyak ","1907851267529125941","","","in","","0","0","0","https://x.com/jumbofilm_id/status/1907851267529125941","1678688801454194688","jumbofilm_id"
"1907126847399145651","Thu Apr 03 17:38:50 +0000 2025","0","@tanyakanrl seruuu banget ini film!!!!! adekku smpe nangis di adegan berantem trs satu studio heboh jg pas jumbo sap sap sap!!","1907850290566672964","","tanyakanrl","in","art enthusiast | rndm retweet ","0","0","0","https://x.com/kwjnss/status/1907850290566672964","1106465786883768320","kwjnss"
"1907849505405653180","Thu Apr 03 17:35:42 +0000 2025","0","Film Jumbo bagus bgttt aaaaaaaaa 10000000000/10","1907849505405653180","","","in","Jawa Tengah, Indonesia","0","0","0","https://x.com/priscapc_7/status/1907849505405653180","2824436491","priscapc_7"
"1907849402112422114","Thu Apr 03 17:35:18 +0000 2025","58","kemarin pas nonton film jumbo aku naksir banget sama buku dongeng Pulau Gelembung punya Don. kira-kira bakal ada versi cetaknya gak ya https://t.co/VXHqsHWOOL","1907849402112422114","https://pbs.twimg.com/amplify_video_thumb/1881687544943009792/img/ffqrP5zDn6IOYpcN.jpg","","in","","2","1","11","https://x.com/ddreaminc/status/1907849402112422114","1318376010287443969","ddreaminc"
"1907846464665170089","Thu Apr 03 17:23:37 +0000 2025","2","spend time kali ini adalah ajak nonton adek pertama kali ke bioskop! dan kita nonton film animasi JUMBO! https://t.co/MJP3AUHy1y","1907846464665170089","https://pbs.twimg.com/media/GnoIP4ca4AAK4ae.jpg","","in","✮ onedoorB ✮","0","0","1","https://x.com/racoonstr/status/1907846464665170089","1581441287416209408","racoonstr"
"1907833653583114281","Thu Apr 03 16:32:43 +0000 2025","2","open b1g1 film komang &amp; jumbo buat besok cgv sama cinepolis fee 7rb sajaa open b1g1 pabrik gula only cgv sabtu dst maw tny lbh lanjut lgsg DM/wa yaa #wts #zonauang","1907833653583114281","","","in","chemy","0","0","0","https://x.com/purpleyrs/status/1907833653583114281","1540228930824978432","purpleyrs"
"1907833519562514768","Thu Apr 03 16:32:11 +0000 2025","1","Liat review film JUMBO kayaknya bagus.","1907833519562514768","","","in","Jakarta Selatan, DKI Jakarta","0","0","0","https://x.com/ellastism/status/1907833519562514768","1783989179841720320","ellastism"
"1907823393287844168","Thu Apr 03 16:32:10 +0000 2025","2","@drksr__ Yes justru ini yang bikin film Jumbo punya dinamika dan diingat oleh penonton. Bocah segemoy egosentris itu akhirnya tersadar dan menjadi teman yang lebih baik ️","1907833514214699282","","drksr__","in","DKI Jakarta, Indonesia","0","0","0","https://x.com/Ridhoibadurr/status/1907833514214699282","245738221","Ridhoibadurr"
"1907819937667875206","Thu Apr 03 16:28:03 +0000 2025","0","@mendiumn film JUMBO kak gem","1907832480692076915","","mendiumn","in","","0","0","0","https://x.com/hllrychristine/status/1907832480692076915","1738258603071713281","hllrychristine"
"1907618206514294895","Thu Apr 03 16:27:58 +0000 2025","0","@adionooo ahh keren pisan deui tulisana","1907832458005082454","","adionooo","in","Indonesia","0","0","0","https://x.com/KangIndra_/status/1907832458005082454","345819752","KangIndra_"
"1907832002017112358","Thu Apr 03 16:26:09 +0000 2025","0","Kalau liat film jumbo kenapa jadi inget iklan makan bergizi gratis ya","1907832002017112358","","","in","","0","0","0","https://x.com/muhsinbasri_/status/1907832002017112358","1636236835562344448","muhsinbasri_"
"1907831932584620201","Thu Apr 03 16:25:53 +0000 2025","0","Klo kalian ngefans sama Ariel harusnya nonton film Jumbo doong kan yg ngisi suaranya Ariel sama BCL.. Klo yg hobi soal perselingkuhan bisa nonton film Norma yg Wulan Guritno.. Tappii kok malah pada nonton film Pabrik Gula? ","1907831932584620201","","","in","Bandung, Indonesia ","0","0","0","https://x.com/Mamsayyy/status/1907831932584620201","4736895350","Mamsayyy"
"1907831776200052940","Thu Apr 03 16:25:15 +0000 2025","1","Keren banget bang @Adriandhy film Jumbo nya. Sungguh bersyukur atas kualitas top nya https://t.co/4GzX9yN3Zs","1907831776200052940","https://pbs.twimg.com/media/Gnn649JaMAQbQRN.jpg","","in","indonesia","0","0","0","https://x.com/ridhoramadhants/status/1907831776200052940","1035382770","ridhoramadhants"
"1907830718832746945","Thu Apr 03 16:21:03 +0000 2025","5","Ternyata Indonesia bisa loh bikin film animasi sebagus @jumbofilm_id ini ga kalah sama film animasi luar Kagum &amp; terharu bener2 pengalaman nonton yg seru &amp; menyenangkan! Makasi banyak ka @acotenri buat traktirannya *bonus ketemu ka @Adriandhy (creatornya JUMBO) di PS https://t.co/UqNkUD2HRO","1907830718832746945","https://pbs.twimg.com/media/Gnn56nZaMAE3E1k.jpg","","in","","0","0","3","https://x.com/feelicious_yola/status/1907830718832746945","300159942","feelicious_yola"
"1907830535025734102","Thu Apr 03 16:20:19 +0000 2025","9","too bad he's a bully :( tapi karena itu chara development di film Jumbo amat sangat well done!","1907830535025734102","","","in","","0","0","1","https://x.com/clarsyy_/status/1907830535025734102","1782415415676948480","clarsyy_"
"1907829917406146895","Thu Apr 03 16:18:01 +0000 2025","0","Favorit bngtt juga sama semua soundtrack di film jumbo ini. Paling fav sama lagunya pak maliq.","1907829956039840197","","Miraay65","in","Kendal","0","1","0","https://x.com/Miraay65/status/1907829956039840197","1266775839875584007","Miraay65"
"1907829917406146895","Thu Apr 03 16:17:55 +0000 2025","0","Jujur awalnya nonton film jumbo ini ya karna ada @Angga_Yunandaaa Dan ya bener kata @umayshhhhb klo suara angga yg ngebass itu bener bikin candu dan khas bangett. Temenku aja pada bilang suaranya angga bangett ya emang iya yak. Wkw","1907829929581990243","","Miraay65","in","Kendal","0","1","0","https://x.com/Miraay65/status/1907829929581990243","1266775839875584007","Miraay65"
"1907829917406146895","Thu Apr 03 16:17:52 +0000 2025","4","Tadi abis nonton film jumbo dan yaaap semenyenangkan itu filmnyaa. Suka banget ceritanya bener bener gak ngebosenin malah gak kerasa filmnya dah abis aja. Jujur diawal aku pikir ini film ceritanya bakal lurus aja alias flat tp ternyata nggak lohh. https://t.co/BsQUXTDIbm","1907829917406146895","https://pbs.twimg.com/media/Gnn5L-0a0AAtmoy.jpg","","in","Kendal","0","1","2","https://x.com/Miraay65/status/1907829917406146895","1266775839875584007","Miraay65"
"1907829380434588111","Thu Apr 03 16:15:44 +0000 2025","6","film jumbo bagusss beyond expectation!! seruuu bikin ketawa dan haru jg seneng bisa ajak adek nonton ini! https://t.co/HfNop8F74h","1907829380434588111","https://pbs.twimg.com/media/Gnn4tFWaMAQCy3A.jpg","","in","zou island","0","2","1","https://x.com/killuasce/status/1907829380434588111","1723742877325590528","killuasce"
"1907828910034706742","Thu Apr 03 16:13:52 +0000 2025","0","Nonton film Jumbo yuuuu","1907828910034706742","","","in","Indonesia","0","0","0","https://x.com/nurulzzt_/status/1907828910034706742","2706599551","nurulzzt_"
"1907828647308009729","Thu Apr 03 16:12:49 +0000 2025","2","mereka oshi-ku di film JUMBO","1907828647308009729","","","in","Tangerang, Indonesia","0","0","0","https://x.com/heloitsaoi/status/1907828647308009729","134324182","heloitsaoi"
"1907827502585966783","Thu Apr 03 16:08:20 +0000 2025","2","pun tidak lupa the highest appreciate utk pacarku yg sudah mewujudkan wishlist kami dari pertama kali film ini di-announce. nasuha harus bermacet-macetan nerjang hujan angin demi menemaniku bertemu dengan Geng Jumbo. terimakasih ya kamu selalu mengusahakan dan berperan https://t.co/rHzDQ6TlRm","1907827515219128807","https://pbs.twimg.com/media/Gnn3AmOaMAAy0A0.jpg","cattoru_","in","kampung seruni","0","0","0","https://x.com/cattoru_/status/1907827515219128807","1289590651839844352","cattoru_"
"1907827502648799744","Thu Apr 03 16:08:17 +0000 2025","5","bang ryan @Adriandhy terima kasih sebesar-besarnya sudah turut membuat dan memajukan industri film lewat Jumbo! semoga abang dan seluruh crew selalu dikelilingi kebaikan ya. peluk hangat (aku mewek)","1907827502648799744","","","in","","0","0","1","https://x.com/bubblebassgirl/status/1907827502648799744","1137571602151776259","bubblebassgirl"
